{"schema_version":"skill-matrix-v1","contract_version":"1.0.0","verification_status":"draft-validated","open_issues":[],"job":{"id":"JOB-ROBOT-001","title":"工业机器人操作调整工","industry":"智能制造/工业机器人工作站装调与数字孪生实训","level":"中级","responsibilities":["操作与调整工业机器人工作站","完成示教编程、坐标标定与工艺参数设置","执行设备点检、故障初判和安全停机"],"sources":[{"source_id":"MOHRSS-MOE-VOC-ROBOT","title":"人社部/教育部职业教育标准（测试引用）","version":"test-2026","locator":"job-profile.robot-operator","evidence":"岗位职责与安全边界测试依据"},{"source_id":"CVTE-SUPPLY-001","title":"CVTE supply chain equipment requirements","version":"test-2026","locator":"equipment.robot-cell","evidence":"机器人工作站、PLC、视觉与数字孪生设备要求"}]},"competencies":[{"id":"COMP-ROBOT-SAFETY","job_id":"JOB-ROBOT-001","name":"机器人工作站安全操作","domain":"safety","level":5,"observable_behaviors":["执行点检、模式切换、急停和能量隔离流程"],"evidence_requirements":["安全检查表、教师观察记录、急停演示"],"tools":["安全围栏","急停回路","LOTO清单"],"safety_critical":true,"module_ids":["MOD-ROBOT-SAFETY"],"sources":[{"source_id":"MOHRSS-MOE-VOC-ROBOT","title":"人社部/教育部职业教育标准（测试引用）","version":"test-2026","locator":"safety.controls"}]},{"id":"COMP-ROBOT-TEACH","job_id":"JOB-ROBOT-001","name":"机器人示教与坐标标定","domain":"skill","level":5,"observable_behaviors":["建立工具/工件坐标并编写可回放示教程序"],"evidence_requirements":["程序文件、坐标表、轨迹回放记录"],"prerequisite_ids":["COMP-ROBOT-SAFETY"],"tools":["示教器","机器人本体","TCP标定工具"],"safety_critical":true,"module_ids":["MOD-ROBOT-TEACH"],"sources":[{"source_id":"CVTE-SUPPLY-001","title":"CVTE supply chain equipment requirements","version":"test-2026","locator":"robot.teach-coordinate"}]},{"id":"COMP-ROBOT-DT","job_id":"JOB-ROBOT-001","name":"数字孪生调试与故障诊断","domain":"quality","level":4,"observable_behaviors":["在隔离仿真中验证I/O、碰撞、异常和恢复路径"],"evidence_requirements":["仿真日志、I/O映射表、故障报告"],"prerequisite_ids":["COMP-ROBOT-TEACH"],"tools":["数字孪生平台","PLC仿真器","示教器模拟器"],"safety_critical":false,"module_ids":["MOD-ROBOT-DT"],"sources":[{"source_id":"CVTE-SUPPLY-001","title":"CVTE supply chain equipment requirements","version":"test-2026","locator":"digital-twin.validation"}]}],"tracking_chain":["JOB-ROBOT-001 -> COMP-ROBOT-SAFETY -> MOD-ROBOT-SAFETY -> SCN-ROBOT-SAFETY -> WO-ROBOT-SAFETY","JOB-ROBOT-001 -> COMP-ROBOT-TEACH -> MOD-ROBOT-TEACH -> SCN-ROBOT-TEACH -> WO-ROBOT-TEACH","JOB-ROBOT-001 -> COMP-ROBOT-DT -> MOD-ROBOT-DT -> SCN-ROBOT-DT -> WO-ROBOT-DT"]}